{
  "id": "long-with-mid-tempo",
  "nameKeys": {
    "enGB": "running.workout.long_with_mid_tempo.name",
    "uk": "running.workout.long_with_mid_tempo.name"
  },
  "category": "long",
  "level": "intermediate",
  "durationMinutes": {
    "typical": 100,
    "min": 85,
    "max": 130
  },
  "structure": [
    {
      "phase": "warmup",
      "descriptionKey": "running.workout.long_with_mid_tempo.structure.warmup"
    },
    {
      "phase": "main",
      "descriptionKey": "running.workout.long_with_mid_tempo.structure.main"
    },
    {
      "phase": "cooldown",
      "descriptionKey": "running.workout.long_with_mid_tempo.structure.cooldown"
    }
  ],
  "intensityTargets": {
    "hrZones": [
      "z2",
      "z3",
      "z4"
    ],
    "paceZones": [
      "easy",
      "threshold"
    ],
    "primaryLabel": "mixed",
    "rpeRange": "3-7"
  },
  "cues": [
    "Insert a middle threshold block.",
    "Stop or ease if sharp pain appears."
  ],
  "evidenceRefs": [
    {
      "kind": "doi",
      "id": "10.1123/ijspp.5.3.276",
      "label": "Seiler 2010 — endurance intensity/duration distribution",
      "supports": [
        "endurance",
        "programming"
      ]
    },
    {
      "kind": "doi",
      "id": "10.1249/MSS.0b013e318213fefb",
      "label": "Garber et al. 2011 ACSM — quantity/quality of exercise",
      "supports": [
        "endurance",
        "programming",
        "safety"
      ]
    }
  ],
  "notes": "Bundled prescription content only — pacing/HR algorithms live outside this pack."
}
