{
  "id": "recovery-jog",
  "nameKeys": {
    "enGB": "running.workout.recovery_jog.name",
    "uk": "running.workout.recovery_jog.name"
  },
  "category": "easy",
  "level": "beginner",
  "durationMinutes": {
    "typical": 25,
    "min": 15,
    "max": 55
  },
  "structure": [
    {
      "phase": "warmup",
      "descriptionKey": "running.workout.recovery_jog.structure.warmup"
    },
    {
      "phase": "main",
      "descriptionKey": "running.workout.recovery_jog.structure.main"
    },
    {
      "phase": "cooldown",
      "descriptionKey": "running.workout.recovery_jog.structure.cooldown"
    }
  ],
  "intensityTargets": {
    "hrZones": [
      "z1"
    ],
    "paceZones": [
      "easy"
    ],
    "primaryLabel": "easy",
    "rpeRange": "2-3"
  },
  "cues": [
    "Very easy; shorten stride if sore.",
    "Stop or ease if sharp pain appears."
  ],
  "evidenceRefs": [
    {
      "kind": "doi",
      "id": "10.1123/ijspp.5.3.276",
      "label": "Seiler 2010 — endurance intensity/duration distribution",
      "supports": [
        "endurance",
        "programming"
      ]
    },
    {
      "kind": "doi",
      "id": "10.1249/MSS.0b013e318213fefb",
      "label": "Garber et al. 2011 ACSM — quantity/quality of exercise",
      "supports": [
        "endurance",
        "programming",
        "safety"
      ]
    }
  ],
  "notes": "Bundled prescription content only — pacing/HR algorithms live outside this pack."
}
