{
  "id": "anaerobic-200s",
  "nameKeys": {
    "enGB": "running.workout.anaerobic_200s.name",
    "uk": "running.workout.anaerobic_200s.name"
  },
  "category": "intervals",
  "level": "advanced",
  "durationMinutes": {
    "typical": 35,
    "min": 20,
    "max": 65
  },
  "structure": [
    {
      "phase": "warmup",
      "descriptionKey": "running.workout.anaerobic_200s.structure.warmup"
    },
    {
      "phase": "main",
      "descriptionKey": "running.workout.anaerobic_200s.structure.main"
    },
    {
      "phase": "cooldown",
      "descriptionKey": "running.workout.anaerobic_200s.structure.cooldown"
    }
  ],
  "intensityTargets": {
    "hrZones": [
      "z5"
    ],
    "paceZones": [
      "repetition"
    ],
    "primaryLabel": "repetition",
    "rpeRange": "8-9"
  },
  "cues": [
    "Short fast reps; walk/jog recoveries.",
    "Stop or ease if sharp pain appears."
  ],
  "evidenceRefs": [
    {
      "kind": "doi",
      "id": "10.1123/ijspp.5.3.276",
      "label": "Seiler 2010 — endurance intensity/duration distribution",
      "supports": [
        "endurance",
        "programming"
      ]
    },
    {
      "kind": "doi",
      "id": "10.3389/fphys.2014.00033",
      "label": "Stöggl & Sperlich 2014 — polarised vs threshold TID",
      "supports": [
        "endurance",
        "programming"
      ]
    },
    {
      "kind": "doi",
      "id": "10.1249/MSS.0b013e318213fefb",
      "label": "Garber et al. 2011 ACSM — quantity/quality of exercise",
      "supports": [
        "endurance",
        "programming",
        "safety"
      ]
    }
  ],
  "notes": "Bundled prescription content only — pacing/HR algorithms live outside this pack."
}
