{
  "id": "hill-repeats-short",
  "nameKeys": {
    "enGB": "running.workout.hill_repeats_short.name",
    "uk": "running.workout.hill_repeats_short.name"
  },
  "category": "hill",
  "level": "intermediate",
  "durationMinutes": {
    "typical": 35,
    "min": 20,
    "max": 65
  },
  "structure": [
    {
      "phase": "warmup",
      "descriptionKey": "running.workout.hill_repeats_short.structure.warmup"
    },
    {
      "phase": "main",
      "descriptionKey": "running.workout.hill_repeats_short.structure.main"
    },
    {
      "phase": "cooldown",
      "descriptionKey": "running.workout.hill_repeats_short.structure.cooldown"
    }
  ],
  "intensityTargets": {
    "hrZones": [
      "z4",
      "z5"
    ],
    "paceZones": [
      "interval",
      "repetition"
    ],
    "primaryLabel": "interval",
    "rpeRange": "7-8"
  },
  "cues": [
    "Short steep reps; walk down recoveries.",
    "Stop or ease if sharp pain appears."
  ],
  "evidenceRefs": [
    {
      "kind": "doi",
      "id": "10.1123/ijspp.5.3.276",
      "label": "Seiler 2010 — endurance intensity/duration distribution",
      "supports": [
        "endurance",
        "programming"
      ]
    },
    {
      "kind": "doi",
      "id": "10.3389/fphys.2014.00033",
      "label": "Stöggl & Sperlich 2014 — polarised vs threshold TID",
      "supports": [
        "endurance",
        "programming"
      ]
    },
    {
      "kind": "doi",
      "id": "10.1249/MSS.0b013e318213fefb",
      "label": "Garber et al. 2011 ACSM — quantity/quality of exercise",
      "supports": [
        "endurance",
        "programming",
        "safety"
      ]
    }
  ],
  "notes": "Bundled prescription content only — pacing/HR algorithms live outside this pack."
}
