{
  "id": "structured-fartlek",
  "nameKeys": {
    "enGB": "running.workout.structured_fartlek.name",
    "uk": "running.workout.structured_fartlek.name"
  },
  "category": "fartlek",
  "level": "intermediate",
  "durationMinutes": {
    "typical": 45,
    "min": 30,
    "max": 75
  },
  "structure": [
    {
      "phase": "warmup",
      "descriptionKey": "running.workout.structured_fartlek.structure.warmup"
    },
    {
      "phase": "main",
      "descriptionKey": "running.workout.structured_fartlek.structure.main"
    },
    {
      "phase": "cooldown",
      "descriptionKey": "running.workout.structured_fartlek.structure.cooldown"
    }
  ],
  "intensityTargets": {
    "hrZones": [
      "z2",
      "z3",
      "z4"
    ],
    "paceZones": [
      "easy",
      "threshold",
      "interval"
    ],
    "primaryLabel": "mixed",
    "rpeRange": "5-7"
  },
  "cues": [
    "Timed surges with prescribed easy floats.",
    "Stop or ease if sharp pain appears."
  ],
  "evidenceRefs": [
    {
      "kind": "doi",
      "id": "10.1123/ijspp.5.3.276",
      "label": "Seiler 2010 — endurance intensity/duration distribution",
      "supports": [
        "endurance",
        "programming"
      ]
    },
    {
      "kind": "doi",
      "id": "10.3389/fphys.2014.00033",
      "label": "Stöggl & Sperlich 2014 — polarised vs threshold TID",
      "supports": [
        "endurance",
        "programming"
      ]
    },
    {
      "kind": "doi",
      "id": "10.1249/MSS.0b013e318213fefb",
      "label": "Garber et al. 2011 ACSM — quantity/quality of exercise",
      "supports": [
        "endurance",
        "programming",
        "safety"
      ]
    }
  ],
  "notes": "Bundled prescription content only — pacing/HR algorithms live outside this pack."
}
